<?xml version="1.0"?>
<!DOCTYPE Report
[
<!ELEMENT Report (General ,(Doc|BPT)) >
<!ATTLIST Report ver CDATA #REQUIRED tmZone CDATA #REQUIRED>

<!ELEMENT General ( DocLocation ) >
<!ATTLIST General productName CDATA #REQUIRED productVer CDATA #REQUIRED os CDATA #REQUIRED host CDATA #REQUIRED qcserver CDATA #IMPLIED qcproject CDATA #IMPLIED SolManSolutionId CDATA #IMPLIED SolManProjectId CDATA #IMPLIED SolManTestPlanId CDATA #IMPLIED SolManTestPackageId CDATA #IMPLIED SolManUserInfoData CDATA #IMPLIED  >

<!ELEMENT BPT (DName,Res,DVer?,TSet?,TInst?,NodeArgs,AdditionalInfo*,Doc*) >
<!ATTLIST BPT rID ID #REQUIRED >

<!ELEMENT Doc (DName,ConfName?,Res,DVer?,TSet?,TInst?,RunType?,DT?,AdditionalInfo*,Step*,DIter*,Step*,Action*,Doc*,Summary?,TestMaintenanceSummary*,NodeArgs?) >
<!ATTLIST Doc rID ID #REQUIRED type (Test|BC|BPTWrapperTest|Flow|Group|Action) "Test" productName CDATA #REQUIRED BCIter CDATA #IMPLIED >

<!ELEMENT RunType ( #PCDATA )>
<!ATTLIST RunType fmStep (False|True) "False" batch (False|True) "False" upDesc (False|True) "False" upChk (False|True) "False" upAS (False|True) "False">

<!ELEMENT DName ( #PCDATA ) >

<!ELEMENT ConfName ( #PCDATA ) >

<!ELEMENT Res ( #PCDATA ) >

<!ELEMENT AdditionalInfo (AdditionalDataName,AdditionalDataValue ) >

<!ELEMENT AdditionalDataName ( #PCDATA ) >

<!ELEMENT AdditionalDataValue ( #PCDATA ) >

<!ELEMENT DVer ( #PCDATA ) >

<!ELEMENT TSet ( #PCDATA ) >

<!ELEMENT TInst ( #PCDATA ) >

<!ELEMENT DIter (Step*,Action+,Summary?,NodeArgs)>
<!ATTLIST DIter rID ID #REQUIRED iterID CDATA #REQUIRED>

<!ELEMENT DocLocation ( #PCDATA )>

<!ELEMENT Action (AName,AIter*,(Step|HtmlStep|Action)*, Summary,ActionMaintenanceSummary*, NodeArgs ) >
<!ATTLIST Action rID ID #REQUIRED>

<!ELEMENT AIter ((Step|HtmlStep|Action)*,DataMapping?, Summary?,NodeArgs) >
<!ATTLIST AIter rID ID #REQUIRED iterID CDATA #REQUIRED isCountable (False|True) "False" >

<!ELEMENT AName ( #PCDATA ) >

<!ELEMENT TestMaintenanceSummary (ActionMaintenanceSummary*) >
<!ATTLIST TestMaintenanceSummary ObjectsAdded CDATA #REQUIRED ObjectsUpdated CDATA #REQUIRED StepsUpdated CDATA #REQUIRED StepsComments CDATA #REQUIRED><!ELEMENT ActionMaintenanceSummary (ObjectChange* ) >
<!ATTLIST ActionMaintenanceSummary Action CDATA #REQUIRED Objects CDATA #REQUIRED Updated CDATA #REQUIRED LinesTotal CDATA #REQUIRED Added CDATA #REQUIRED LinesUpdated CDATA #REQUIRED>

<!ELEMENT ObjectChange  (Hierarchy, PropertyChangeList* ) >
<!ATTLIST ObjectChange Operation CDATA #IMPLIED OriginalRepository CDATA #IMPLIED>

<!ELEMENT PropertyChangeList (PropertyDef*) >

<!ELEMENT PropertyDef (OriginalValue, NewValue) >
<!ATTLIST PropertyDef PropName CDATA #REQUIRED OriginRegularExpression (True|False) "False" NewRegularExpression (True|False) "False" AddedProperty (True|False) "False" >

<!ELEMENT OriginalValue ( #PCDATA )>

<!ELEMENT NewValue ( #PCDATA )>

<!ELEMENT Hierarchy  (ObjectName, Hierarchy*) >
<!ATTLIST Hierarchy MicClass CDATA #REQUIRED>

<!ELEMENT ObjectName  ( #PCDATA ) >

<!ELEMENT Step (Obj,Details,Time,TimeTick* ,(Step|HtmlStep|Doc)*, DataMapping?, NodeArgs) >
<!ATTLIST Step rID ID #REQUIRED retval CDATA #IMPLIED>

<!ELEMENT HtmlStep (HTML,TimeTick*,(Step|HtmlStep|Doc)*,NodeArgs) >
<!ATTLIST HtmlStep rID ID #REQUIRED >

<!ELEMENT Obj ( #PCDATA ) >
<!ATTLIST Obj plainTxt (False|True) "True">

<!ELEMENT Details ( #PCDATA ) >
<!ATTLIST Details plainTxt (False|True) "True">

<!ELEMENT Time ( #PCDATA ) >

<!ELEMENT HTML ( #PCDATA ) >

<!ELEMENT Disp ( #PCDATA ) >

<!ELEMENT TimeTick ( #PCDATA ) >

<!ELEMENT DataMapping ( DataMappedItem* )>
<!ELEMENT DataMappedItem EMPTY >
<!ATTLIST DataMappedItem dsName CDATA #REQUIRED >
<!ATTLIST DataMappedItem rowId CDATA #REQUIRED >

<!ELEMENT NodeArgs (Disp,TopPane?,BtmPane?,ExtendedInfo? )>
<!ATTLIST NodeArgs eType CDATA #REQUIRED icon CDATA #REQUIRED nRep CDATA #REQUIRED UserNote CDATA #IMPLIED filter (False|True) "True">
<!ATTLIST NodeArgs status (Passed|Failed|Done|Warning|Information) "Done">
<!ATTLIST NodeArgs iconSel CDATA #IMPLIED nType CDATA #IMPLIED MovieMarker CDATA "">
<!ATTLIST NodeArgs Source CDATA #IMPLIED SourceLine CDATA #IMPLIED StepFlowItemKey CDATA #IMPLIED >

<!ELEMENT TopPane (Path)>

<!ELEMENT BtmPane ( (Path|WR)?,ASHilite?)>
<!ATTLIST BtmPane vType CDATA "HTML">

<!ELEMENT Path ( #PCDATA ) >

<!ELEMENT ASHilite ( #PCDATA ) >

<!ELEMENT WR ( #PCDATA ) >

<!ELEMENT ExtendedInfo ( StepData ) >

<!ATTLIST ExtendedInfo StepType CDATA #REQUIRED>
<!ELEMENT DT (NodeArgs) >
<!ATTLIST DT rID ID #REQUIRED>

<!ELEMENT Summary (Param*)>
<!ATTLIST Summary sTime CDATA #IMPLIED eTime CDATA #IMPLIED passed CDATA #IMPLIED failed CDATA #IMPLIED warnings CDATA #IMPLIED retval CDATA #IMPLIED stopped (False|True) "False" >

<!ELEMENT Param (ParamName,ParamVal)+ >
<!ATTLIST Param paramInOut (In|Out) "In">

<!ELEMENT ParamName ( #PCDATA ) >

<!ELEMENT ParamVal ( #PCDATA ) >

]
>
<Report ver="2.0" tmZone="India Standard Time">
<General productName="Micro Focus Unified Functional Testing" productVer="14.50" os="" host="INLEN8520024624"><DocLocation><![CDATA[C:\Payback\Payback_Project]]></DocLocation></General>
<Doc rID="T1"   productName= "Micro Focus Unified Functional Testing"  >
<DName><![CDATA[Payback_Project]]></DName>
<Res><![CDATA[Res90]]></Res>
<DT rID="T2">
<NodeArgs eType="Table" icon="2" nRep="4" filter="False" >
<Disp><![CDATA[Run-Time Data Table]]></Disp>
<BtmPane vType="Table" >
<Path><![CDATA[Default.xls]]></Path>
</BtmPane>
</NodeArgs>
</DT>
<DIter rID="T3" iterID="1" >
<Action rID="T4">
<AName><![CDATA[Login]]></AName>
<Step rID="T5">
<Obj plainTxt="False" ><![CDATA[Zillion - aha, everywhere!]]></Obj>
<Details plainTxt="False" ><![CDATA[<table><tr><td><span style="text-align : left; font-size : 12px; ">Local Browser</span></td></tr></table>]]></Details>
<Time><![CDATA[06-09-2023 - 17:54:10]]></Time>
<TimeTick>1694003050</TimeTick>
<Step rID="T6">
<Obj plainTxt="False" ><![CDATA[Zillion - aha, everywhere!]]></Obj>
<Details plainTxt="False" ><![CDATA[Page]]></Details>
<Time><![CDATA[06-09-2023 - 17:54:10]]></Time>
<TimeTick>1694003050</TimeTick>
<Step rID="T7">
<Obj plainTxt="False" ><![CDATA[LOGIN / SIGNUP.Exist]]></Obj>
<Details plainTxt="False" ><![CDATA["Object exists"]]></Details>
<Time><![CDATA[06-09-2023 - 17:54:10]]></Time>
<TimeTick>1694003050</TimeTick>
<NodeArgs eType="Replay" icon="7" nRep="12" >
<Disp><![CDATA[LOGIN / SIGNUP.Exist]]></Disp>
</NodeArgs>
</Step>
<NodeArgs eType="Context" icon="6" nRep="11" >
<Disp><![CDATA[Zillion - aha, everywhere!]]></Disp>
</NodeArgs>
</Step>
<NodeArgs eType="Context" icon="5" nRep="10" >
<Disp><![CDATA[Zillion - aha, everywhere!]]></Disp>
</NodeArgs>
</Step>
<Step rID="T8">
<Obj ><![CDATA[Login successfully]]></Obj>
<Details ><![CDATA[PASSED]]></Details>
<Time><![CDATA[06-09-2023 - 17:54:10]]></Time>
<TimeTick>1694003050</TimeTick>
<NodeArgs eType="User" icon="8" nRep="13" status="Passed" >
<Disp><![CDATA[Login successfully]]></Disp>
</NodeArgs>
</Step>
<Step rID="T9">
<Obj plainTxt="False" ><![CDATA[Zillion - aha, everywhere!]]></Obj>
<Details plainTxt="False" ><![CDATA[<table><tr><td><span style="text-align : left; font-size : 12px; ">Local Browser</span></td></tr></table>]]></Details>
<Time><![CDATA[06-09-2023 - 17:54:10]]></Time>
<TimeTick>1694003050</TimeTick>
<Step rID="T10">
<Obj plainTxt="False" ><![CDATA[Zillion - aha, everywhere!]]></Obj>
<Details plainTxt="False" ><![CDATA[Page]]></Details>
<Time><![CDATA[06-09-2023 - 17:54:10]]></Time>
<TimeTick>1694003050</TimeTick>
<Step rID="T11">
<Obj plainTxt="False" ><![CDATA[LOGIN / SIGNUP.Click]]></Obj>
<Details plainTxt="False" ><![CDATA[]]></Details>
<Time><![CDATA[06-09-2023 - 17:54:10]]></Time>
<TimeTick>1694003050</TimeTick>
<NodeArgs eType="Replay" icon="7" nRep="18" >
<Disp><![CDATA[LOGIN / SIGNUP.Click]]></Disp>
</NodeArgs>
</Step>
<NodeArgs eType="Context" icon="6" nRep="17" >
<Disp><![CDATA[Zillion - aha, everywhere!]]></Disp>
</NodeArgs>
</Step>
<Step rID="T12">
<Obj plainTxt="False" ><![CDATA[Zillion - aha, everywhere!_2]]></Obj>
<Details plainTxt="False" ><![CDATA[Page]]></Details>
<Time><![CDATA[06-09-2023 - 17:54:11]]></Time>
<TimeTick>1694003051</TimeTick>
<Step rID="T13">
<Obj plainTxt="False" ><![CDATA[WebNumber.Set]]></Obj>
<Details plainTxt="False" ><![CDATA["9164799194"]]></Details>
<Time><![CDATA[06-09-2023 - 17:54:11]]></Time>
<TimeTick>1694003051</TimeTick>
<NodeArgs eType="Replay" icon="9" nRep="22" >
<Disp><![CDATA[WebNumber.Set]]></Disp>
</NodeArgs>
</Step>
<Step rID="T14">
<Obj plainTxt="False" ><![CDATA[CONTINUE.Click]]></Obj>
<Details plainTxt="False" ><![CDATA[]]></Details>
<Time><![CDATA[06-09-2023 - 17:54:11]]></Time>
<TimeTick>1694003051</TimeTick>
<NodeArgs eType="Replay" icon="7" nRep="25" >
<Disp><![CDATA[CONTINUE.Click]]></Disp>
</NodeArgs>
</Step>
<Step rID="T15">
<Obj plainTxt="False" ><![CDATA[CONTINUE.Click]]></Obj>
<Details plainTxt="False" ><![CDATA[]]></Details>
<Time><![CDATA[06-09-2023 - 17:54:26]]></Time>
<TimeTick>1694003066</TimeTick>
<NodeArgs eType="Replay" icon="7" nRep="28" >
<Disp><![CDATA[CONTINUE.Click]]></Disp>
</NodeArgs>
</Step>
<NodeArgs eType="Context" icon="6" nRep="21" >
<Disp><![CDATA[Zillion - aha, everywhere!_2]]></Disp>
</NodeArgs>
</Step>
<NodeArgs eType="Context" icon="5" nRep="16" >
<Disp><![CDATA[Zillion - aha, everywhere!]]></Disp>
</NodeArgs>
</Step>
<Step rID="T16">
<Obj ><![CDATA[Login successfully]]></Obj>
<Details ><![CDATA[PASSED]]></Details>
<Time><![CDATA[06-09-2023 - 17:54:26]]></Time>
<TimeTick>1694003066</TimeTick>
<NodeArgs eType="User" icon="8" nRep="29" status="Passed" >
<Disp><![CDATA[Login successfully]]></Disp>
</NodeArgs>
</Step>
<Step rID="T17">
<Obj plainTxt="False" ><![CDATA[Zillion - aha, everywhere!_2]]></Obj>
<Details plainTxt="False" ><![CDATA[<table><tr><td><span style="text-align : left; font-size : 12px; ">Local Browser</span></td></tr></table>]]></Details>
<Time><![CDATA[06-09-2023 - 17:54:29]]></Time>
<TimeTick>1694003069</TimeTick>
<Step rID="T18">
<Obj plainTxt="False" ><![CDATA[Zillion - aha, everywhere!]]></Obj>
<Details plainTxt="False" ><![CDATA[Page]]></Details>
<Time><![CDATA[06-09-2023 - 17:54:29]]></Time>
<TimeTick>1694003069</TimeTick>
<Step rID="T19">
<Obj plainTxt="False" ><![CDATA[WebElement.Exist]]></Obj>
<Details plainTxt="False" ><![CDATA["Object exists"]]></Details>
<Time><![CDATA[06-09-2023 - 17:54:29]]></Time>
<TimeTick>1694003069</TimeTick>
<NodeArgs eType="Replay" icon="10" nRep="52" >
<Disp><![CDATA[WebElement.Exist]]></Disp>
</NodeArgs>
</Step>
<NodeArgs eType="Context" icon="6" nRep="51" >
<Disp><![CDATA[Zillion - aha, everywhere!]]></Disp>
</NodeArgs>
</Step>
<NodeArgs eType="Context" icon="5" nRep="50" >
<Disp><![CDATA[Zillion - aha, everywhere!_2]]></Disp>
</NodeArgs>
</Step>
<Step rID="T20">
<Obj ><![CDATA[Ledger is working]]></Obj>
<Details ><![CDATA[PASSED]]></Details>
<Time><![CDATA[06-09-2023 - 17:54:29]]></Time>
<TimeTick>1694003069</TimeTick>
<NodeArgs eType="User" icon="8" nRep="53" status="Passed" >
<Disp><![CDATA[Ledger is working]]></Disp>
</NodeArgs>
</Step>
<Step rID="T21">
<Obj plainTxt="False" ><![CDATA[Zillion - aha, everywhere!_2]]></Obj>
<Details plainTxt="False" ><![CDATA[<table><tr><td><span style="text-align : left; font-size : 12px; ">Local Browser</span></td></tr></table>]]></Details>
<Time><![CDATA[06-09-2023 - 17:54:30]]></Time>
<TimeTick>1694003070</TimeTick>
<Step rID="T22">
<Obj plainTxt="False" ><![CDATA[Zillion - aha, everywhere!]]></Obj>
<Details plainTxt="False" ><![CDATA[Page]]></Details>
<Time><![CDATA[06-09-2023 - 17:54:30]]></Time>
<TimeTick>1694003070</TimeTick>
<Step rID="T23">
<Obj plainTxt="False" ><![CDATA[WebElement.Click]]></Obj>
<Details plainTxt="False" ><![CDATA[]]></Details>
<Time><![CDATA[06-09-2023 - 17:54:30]]></Time>
<TimeTick>1694003070</TimeTick>
<NodeArgs eType="Replay" icon="10" nRep="58" >
<Disp><![CDATA[WebElement.Click]]></Disp>
</NodeArgs>
</Step>
<Step rID="T24">
<Obj plainTxt="False" ><![CDATA[[ WebElement ]]]></Obj>
<Details plainTxt="False" ><![CDATA[Cannot&nbsp;identify&nbsp;the&nbsp;object&nbsp;"[&nbsp;WebElement&nbsp;]"&nbsp;(of&nbsp;class&nbsp;WebElement).<br/>Verify&nbsp;that&nbsp;this&nbsp;object's&nbsp;properties&nbsp;match&nbsp;an&nbsp;object&nbsp;currently&nbsp;displayed&nbsp;in&nbsp;your&nbsp;application.]]></Details>
<Time><![CDATA[06-09-2023 - 17:54:50]]></Time>
<TimeTick>1694003090</TimeTick>
<Step rID="T25">
<Obj plainTxt="False" ><![CDATA[[ WebElement ]]]></Obj>
<Details plainTxt="False" ><![CDATA[Object's physical description:<br>xpath = //*[@id='__next']/main/div/div[1]/div/div[2]/div[2]/div/div[2]/div[2]/div[2]/div[1]/div[2]<br>Mercury Class = WebElement<br>]]></Details>
<Time><![CDATA[06-09-2023 - 17:54:50]]></Time>
<TimeTick>1694003090</TimeTick>
<NodeArgs eType="Replay" icon="11" nRep="102" status="Warning" nType="Description" >
<Disp><![CDATA[[ WebElement ]]]></Disp>
</NodeArgs>
</Step>
<NodeArgs eType="Replay" icon="10" nRep="101" status="Failed" nType="Run Error" >
<Disp><![CDATA[[ WebElement ]]]></Disp>
</NodeArgs>
</Step>
<NodeArgs eType="Context" icon="6" nRep="57" status="Failed" >
<Disp><![CDATA[Zillion - aha, everywhere!]]></Disp>
</NodeArgs>
</Step>
<Step rID="T26">
<Obj plainTxt="False" ><![CDATA[Profile | Zillion - aha,]]></Obj>
<Details plainTxt="False" ><![CDATA[Page]]></Details>
<Time><![CDATA[06-09-2023 - 17:55:11]]></Time>
<TimeTick>1694003111</TimeTick>
<Step rID="T27">
<Obj plainTxt="False" ><![CDATA[All]]></Obj>
<Details plainTxt="False" ><![CDATA[Cannot&nbsp;identify&nbsp;the&nbsp;object&nbsp;"All"&nbsp;(of&nbsp;class&nbsp;WebElement).<br/>Verify&nbsp;that&nbsp;this&nbsp;object's&nbsp;properties&nbsp;match&nbsp;an&nbsp;object&nbsp;currently&nbsp;displayed&nbsp;in&nbsp;your&nbsp;application.]]></Details>
<Time><![CDATA[06-09-2023 - 17:55:11]]></Time>
<TimeTick>1694003111</TimeTick>
<Step rID="T28">
<Obj plainTxt="False" ><![CDATA[All]]></Obj>
<Details plainTxt="False" ><![CDATA[Object's physical description:<br>Mercury Class = WebElement<br>Html Tag = SPAN<br>_xpath = //DIV/DIV/DIV/DIV/DIV/DIV/SPAN[normalize-space()="All"]<br>|Visible = -1<br>innertext = All<br>Html Id = <br>DHTML Class = text-xs text-center rounded-lg font-heavy br-l10 filter-header__tile w-full bg-theme-2 clr-white animated.delay-2s clicking-animation p-2<br>acc_name = <br>]]></Details>
<Time><![CDATA[06-09-2023 - 17:55:11]]></Time>
<TimeTick>1694003111</TimeTick>
<NodeArgs eType="Replay" icon="11" nRep="147" status="Warning" nType="Description" >
<Disp><![CDATA[All]]></Disp>
</NodeArgs>
</Step>
<NodeArgs eType="Replay" icon="10" nRep="146" status="Failed" nType="Run Error" >
<Disp><![CDATA[All]]></Disp>
</NodeArgs>
</Step>
<NodeArgs eType="Context" icon="6" nRep="145" status="Failed" >
<Disp><![CDATA[Profile | Zillion - aha,]]></Disp>
</NodeArgs>
</Step>
<NodeArgs eType="Context" icon="5" nRep="56" status="Failed" >
<Disp><![CDATA[Zillion - aha, everywhere!_2]]></Disp>
</NodeArgs>
</Step>
<Step rID="T29">
<Obj plainTxt="False" ><![CDATA[Zillion - aha, everywhere!_2]]></Obj>
<Details plainTxt="False" ><![CDATA[<table><tr><td><span style="text-align : left; font-size : 12px; ">Local Browser</span></td></tr></table>]]></Details>
<Time><![CDATA[06-09-2023 - 17:55:11]]></Time>
<TimeTick>1694003111</TimeTick>
<Step rID="T30">
<Obj plainTxt="False" ><![CDATA[Run Error]]></Obj>
<Details plainTxt="False" ><![CDATA[Cannot identify the object &quot;All&quot; (of class WebElement).<BR/>Verify that this object's properties match an object currently displayed in your application.<BR/>Function file: C:\Appspace.qfl<BR/>Line (29): &quot;	   Browser(&quot;Zillion - aha, everywhere!_2&quot;).Page(&quot;Profile | Zillion - aha,&quot;).WebElement(&quot;All&quot;).Click     'All&quot;.]]></Details>
<Time><![CDATA[06-09-2023 - 17:55:11]]></Time>
<TimeTick>1694003111</TimeTick>
<NodeArgs eType="Replay" icon="11" nRep="149" status="Failed" Source="C:\Appspace.qfl" SourceLine="28" >
<Disp><![CDATA[Run Error]]></Disp>
<BtmPane vType="ViewerGen.SSViewerGen" >
<Path><![CDATA[ZIP::Act1\Row0\ssf8.xml]]></Path>
<ASHilite><![CDATA[724504]]></ASHilite>
</BtmPane>
</NodeArgs>
</Step>
<Step rID="T31">
<Obj plainTxt="False" ><![CDATA[Stop Run]]></Obj>
<Details plainTxt="False" ><![CDATA[Run stopped by user.]]></Details>
<Time><![CDATA[06-09-2023 - 17:55:37]]></Time>
<TimeTick>1694003137</TimeTick>
<NodeArgs eType="General" icon="12" nRep="150" status="Information" >
<Disp><![CDATA[Stop Run]]></Disp>
</NodeArgs>
</Step>
<NodeArgs eType="Context" icon="5" nRep="148" status="Failed" Source="C:\Appspace.qfl" SourceLine="-1" >
<Disp><![CDATA[Zillion - aha, everywhere!_2]]></Disp>
<BtmPane vType="ViewerGen.SSViewerGen" >
<Path><![CDATA[ZIP::Act1\Row0\ssf7.xml]]></Path>
<ASHilite><![CDATA[724504]]></ASHilite>
</BtmPane>
</NodeArgs>
</Step>
<Summary sTime="06-09-2023 - 17:53:50" eTime="06-09-2023 - 17:55:37" passed="3" failed="3" warnings="2" ></Summary>
<NodeArgs eType="StartAction" icon="4" nRep="8" status="Failed" >
<Disp><![CDATA[Login Summary]]></Disp>
</NodeArgs>
</Action>
<NodeArgs eType="StartIteration" icon="3" nRep="6" status="Failed" >
<Disp><![CDATA[Payback_Project Iteration 1 (Row 1)]]></Disp>
</NodeArgs>
</DIter>
<Summary sTime="06-09-2023 - 17:53:43" eTime="06-09-2023 - 17:55:37" passed="3" failed="3" warnings="2" ></Summary>
<NodeArgs eType="StartTest" icon="1" nRep="3" status="Failed" >
<Disp><![CDATA[Test Payback_Project Summary]]></Disp>
</NodeArgs>
</Doc>
</Report>